340,亂偄偄偹両亃,僩儔僀傾儖僣傾乕傪僋儕傾偟偨,0
341,亂偁傞妛峑偺堦枊亃,儃僗儔僢僔儏傪僋儕傾偟偨,0
342,亂偁傞巓枀偺懳棫亃,僆乕儖僗僥乕僕僣傾乕傪僋儕傾偟偨,0
343,亂傾儞僯儏僀僉儍僢僩亃,僗僺乕僪儔儞傪姰憱偟偨,0
344,亂價乕僠僐儈儏僯僥傿亃,僩儔僀傾儖僣傾乕傪僫僀僩儊傾偱僋儕傾偟偨,0
345,嬻偒,NULL,0
346,嬻偒,NULL,0
347,嬻偒,NULL,0
348,嬻偒,NULL,0
349,嬻偒,NULL,0
350,亂俫俬俶俿亃,婎杮偼僠儏乕僩儕傾儖偐傜偱偡丅,0
351,亂俫俬俶俿亃,儊僀儞儌乕僪傪恑傔偰傒傑偟傚偆丅,0
352,亂俫俬俶俿亃,儊僀儞儌乕僪傪恑傔偰傒傑偟傚偆丅,0
353,亂俫俬俶俿亃,儊僀儞儌乕僪傪恑傔偰傒傑偟傚偆丅,0
354,亂俫俬俶俿亃,儊僀儞儌乕僪傪恑傔偰傒傑偟傚偆丅,0
355,亂俫俬俶俿亃,儊僀儞儌乕僪傪恑傔偰傒傑偟傚偆丅,0
356,亂俫俬俶俿亃,儊僀儞儌乕僪傪恑傔偰傒傑偟傚偆丅,0
357,亂俫俬俶俿亃,儊僀儞儌乕僪傪恑傔偰傒傑偟傚偆丅,0
358,亂俫俬俶俿亃,儊僀儞儌乕僪傪恑傔偰傒傑偟傚偆丅,0
359,亂俫俬俶俿亃,儊僀儞儌乕僪傪恑傔偰傒傑偟傚偆丅,0
360,亂俫俬俶俿亃,僩儔僀傾儖傪僇僕儏傾儖偱僋儕傾偟偰傒傑偟傚偆丅,0
361,亂俫俬俶俿亃,僩儔僀傾儖傪儅僯傾僢僋偱僋儕傾偟偰傒傑偟傚偆丅,0
362,亂俫俬俶俿亃,僩儔僀傾儖傪僄僉僗僷乕僩偱僋儕傾偟偰傒傑偟傚偆丅,0
363,亂俫俬俶俿亃,僩儔僀傾儖僣傾乕偱埆柌偺傛偆側抏枊傪撍攋偟偰傒傑偟傚偆両,0
364,亂俫俬俶俿亃,僩儔僀傾儖偺塀偝傟偨僐儈儏僯僥傿傪峌棯偟偰傒傑偟傚偆両,0
365,亂俫俬俶俿亃,偡傋偰偺儃僗傪搢偟偪傖偄傑偟傚偆両,0
366,亂俫俬俶俿亃,埆柌偺嫢埆儃僗傪骧鏦偟偪傖偄傑偟傚偆両,0
367,亂俫俬俶俿亃,偳偆偣側傜慡僐儈儏僯僥傿夞偭偪傖偄傑偟傚偆両,0
368,亂俫俬俶俿亃,寕偪曉偟抏偵摙偪彑偪傑偟傚偆両,0
369,亂俫俬俶俿亃,峏偵寖偟偄寕偪曉偟抏偵摙偪彑偪傑偟傚偆両,0
370,亂俫俬俶俿亃,偁偺巕偺偍桭払傪寕偪棊偲偟偰傒傑偟傚偆丅,0
371,亂俫俬俶俿亃,旤枴偟偄傕偺偼巆偝偢怘傋偪傖偄傑偟傚偆丅,0
372,亂俫俬俶俿亃,浠乆壴偝傫偺價僢僩偭偰偄偭傁偄偱偰偒傑偡傛偹丠,0
373,亂俫俬俶俿亃,僋儔僎偺怗庤傪嵞惗偝傟傞慜偵夡偟偪傖偄傑偟傚偆丅,0
374,亂俫俬俶俿亃,儚僀儞僟乕偵塃偵嵍偵梙傜傟偪傖偄傑偟傚偆丅,0
375,亂俫俬俶俿亃,偒傘傝偝傫偑壗偐塀偟偰傞偦偆偱偡傛丠,0
376,亂俫俬俶俿亃,僔傾儞偝傫偑壗偐塀偟偰傞偦偆偱偡傛丠,0
377,亂俫俬俶俿亃,岝傞壗幰偐偑壗偐塀偟偰傞偦偆偱偡傛丠,0
378,亂俫俬俶俿亃,儊儞僞儖儗儀儖偑偁傞偺偵儈僗偟偪傖偆偲傕偭偨偄側偄偱偡偹丅,0
379,亂俫俬俶俿亃,偄偄偹側傫偰柍偔偰傕彑偰傟偽偄偄偭偰巚偆偙偲偁傝傑偣傫丠,0
380,亂俫俬俶俿亃,儃儉傪偨偔偝傫巊偭偪傖偄傑偟傚偆丅,0
381,亂俫俬俶俿亃,儃儉傪傕偭偲傕偭偲巊偭偪傖偄傑偟傚偆両,0
382,亂俫俬俶俿亃,偄偭傁偄壱偄偱偄偭傁偄僶僘偭偪傖偄傑偟傚偆丅,0
383,亂俫俬俶俿亃,傕偭偲傕乕偭偲僶僘偭偪傖偄傑偟傚偆両,0
384,亂俫俬俶俿亃,揋傪偄偭傁偄搢偟傑偟傚偆丅,0
385,亂俫俬俶俿亃,揋傪傕偭偲偄偭傁偄搢偟傑偟傚偆両,0
386,亂俫俬俶俿亃,揋傪搢偡偲偒偼僌僢偲嬤偯偄偰僈僠楒嫍棧偱偡両,0
387,亂俫俬俶俿亃,揋偵傕偭偲偄偭傁偄嬤偯偄偪傖偄傑偟傚偆両,0
388,亂俫俬俶俿亃,抏偵嬤偯偔偲偪傚偭偲偍摼偱偡丅,0
389,亂俫俬俶俿亃,抏側傫偰晐偔偁傝傑偣傫両偳傫偳傫偐偡偭偪傖偄傑偟傚偆両,0
390,亂俫俬俶俿亃,抏枊傪壺楉偵旔偗偪傖偄傑偟傚偆丅,0
391,亂俫俬俶俿亃,抏枊側傫偰摉偨傜側偗傟偽偳偆偭偰偙偲偁傝傑偣傫両,0
392,亂俫俬俶俿亃,僶僘傜偢僗僩僀僢僋偵峌棯偡傞偺傕偐偭偙偄偄偐傕偟傟傑偣傫丅,0
393,亂俫俬俶俿亃,僼僅儘儚乕傪憹傗偟傑偟傚偆丅,0
394,亂俫俬俶俿亃,僼僅儘儚乕傪傕偭偲憹傗偟傑偟傚偆丅,0
395,亂俫俬俶俿亃,僼僅儘儚乕傪偨偭偔偝傫憹傗偟偪傖偄傑偟傚偆両,0
396,亂俫俬俶俿亃,偄偄偹傪憹傗偟傑偟傚偆丅,0
397,亂俫俬俶俿亃,偄偄偹傪傕偭偲憹傗偟傑偟傚偆丅,0
398,亂俫俬俶俿亃,偄偄偹傪偨偭偔偝傫憹傗偟偪傖偄傑偟傚偆両,0
399,亂俫俬俶俿亃,偙傟偑嵟屻偺幚愌偱偡両,0
400,亂傛偆偙偦両亃,僠儏乕僩儕傾儖傪嵟屻傑偱尒偨,0
401,亂偳偆傇偮儚乕儖僪亃,僗僥乕僕侾傪僋儕傾偟偨,0
402,亂偍壻巕偺儚乕儖僪亃,僗僥乕僕俀傪僋儕傾偟偨,0
403,亂僨僕僞儖儚乕儖僪亃,僗僥乕僕俁傪僋儕傾偟偨,0
404,亂奀偺儚乕儖僪亃,僗僥乕僕係傪僋儕傾偟偨,0
405,亂埫埮偺儚乕儖僪亃,僗僥乕僕俆傪僋儕傾偟偨,0
406,亂柌偺儚乕儖僪亃,僗僥乕僕俇傪僋儕傾偟偨,0
407,亂搒巗偺儚乕儖僪亃,僗僥乕僕俈傪僋儕傾偟偨,0
408,亂墹崙偺儚乕儖僪亃,僗僥乕僕俉傪僋儕傾偟偨,0
409,亂旈枾偺儚乕儖僪亃,僗僥乕僕俋傪僋儕傾偟偨,0
410,亂弶媺僔儏乕僞乕亃,僩儔僀傾儖僣傾乕傪僇僕儏傾儖偱僋儕傾偟偨,0
411,亂拞媺僔儏乕僞乕亃,僩儔僀傾儖僣傾乕傪儅僯傾僢僋偱僋儕傾偟偨,0
412,亂弉楙僔儏乕僞乕亃,僩儔僀傾儖僣傾乕傪僄僉僗僷乕僩偱僋儕傾偟偨,0
413,亂払恖僔儏乕僞乕亃,僩儔僀傾儖僣傾乕傪僫僀僩儊傾偱僋儕傾偟偨,0
414,亂恀偺愨懳彑幰亃,僩儔僀傾儖僣傾乕偱僗僥乕僕俋傪僋儕傾偟偨,0
415,亂儃僗儅僯傾亃,儃僗儔僢僔儏傪僋儕傾偟偨,0
416,亂儃僗儅僗僞乕亃,儃僗儔僢僔儏傪僫僀僩儊傾偱僋儕傾偟偨,0
417,亂儘儞僌儔儞僫乕亃,僆乕儖僗僥乕僕僣傾乕傪僋儕傾偟偨,0
418,亂寕偪曉偟揤崙亃,僩儔僀傾儖僣傾乕傪僇僂儞僞乕儌乕僪偱僋儕傾偟偨,0
419,亂寕偪曉偟抧崠亃,僩儔僀傾儖僣傾乕傪僄僉僗僷乕僩埲忋偺僇僂儞僞乕儌乕僪偱僋儕傾偟偨,0
420,亂寖偍偙偹偹偪傖傫亃,傕偪傕偪偹偹偪傖傫偺巕僌儅係旵傪偡傋偰寕攋偟偨,0
421,亂偛偪偦偆偝傑両亃,僗僥乕僕俀拞儃僗傪僶僞乕傪偡傋偰攋夡偟偰偐傜寕攋偟偨,0
422,亂價僢僩傪偄偄偹偵亃,嶗嶁浠乆壴偲偺懳愴偱價僢僩傪俁侽屄攋夡偟偨,0
423,亂傑傫傑傞僋儔僎亃,僋儔僎偺傒偯偒偺儃僗儐僯僢僩偺怗庤傪偡傋偰攋夡偟偨忬懺偵偟偨,0
424,亂崟偒儚僀儞僟乕亃,奊巕戞俇抜奒偱僷乕僼僃僋僩儃乕僫僗傪庢摼偟偨,0
425,亂傒偮偐傝傑偟偨両亃,僗僥乕僕俇拞儃僗乮偒傘傝乯傪侾係昩埲撪偵寕攋偟侾倀俹傾僀僥儉傪弌尰偝偣偨,0
426,亂傒偮偐偭偨偵傖両亃,僗僥乕僕俈拞儃僗乮嬻惎僔傾儞乯傪嵍塃偺儐僯僢僩傪攋夡偟偮偮寕攋偟侾倀俹傾僀僥儉傪弌尰偝偣偨,0
427,亂岝傞偦偭偔傝偝傫亃,僗僥乕僕俉偺岝傞帺暘偵偦偭偔傝側揋傪儃儉傪巊傢偢偵搢偟侾倀俹傾僀僥儉傪弌尰偝偣偨,0
428,亂椳偺書偊棊偪亃,儊儞僞儖儗儀儖嵟戝偺忬懺偱儈僗傪偟偨,0
429,亂彸擣偐傜偺夝曻亃,偄偢傟偐偺僗僥乕僕傪0偄偄偹偱僋儕傾偟偨,0
430,亂儃儞僶乕僈乕儖亃,儃儉傪椵寁20夞敪摦偟偨,0
431,亂儃儞僶乕僋僀乕儞亃,儃儉傪椵寁200夞敪摦偟偨,0
432,亂僶僘傝壆亃,僶僘僼傿乕僶乕傪椵寁20夞敪摦偟偨,0
433,亂僞僀儉儔僀儞忢楢亃,僶僘僼傿乕僶乕傪椵寁200夞敪摦偟偨,0
434,亂抏枊柍憃亃,揋傪椵寁1000懱搢偟偨,0
435,亂寕捘彈墹亃,揋傪椵寁10000懱搢偟偨,0
436,亂僈僠楒僈乕儖亃,捠忢揋偐傜僼僅儘儚乕+10傪椵寁300夞弌尰偝偣偨,0
437,亂僈僠楒儅僗僞乕亃,捠忢揋偐傜僼僅儘儚乕+10傪椵寁3000夞弌尰偝偣偨,0
438,亂婋尟旘峴亃,椵寁500夞揋抏偵偐偡偭偨,0
439,亂柤梍偺偐偡傝彎亃,椵寁20000夞揋抏偵偐偡偭偨,0
440,亂夞旔柤恖亃,椵寁30夞僷乕僼僃僋僩儃乕僫僗傪払惉偟偨,0
441,亂抏枊儅僗僞乕亃,椵寁300夞僷乕僼僃僋僩儃乕僫僗傪払惉偟偨,0
442,亂栚棫偪偨偔側偄亃,僶僘僼傿乕僶乕傪敪摦偣偢偵僩儔僀傾儖僣傾乕傪僋儕傾偟偨,0
443,亂偪傚偭偲桳柤恖亃,僼僅儘儚乕偑1枩偵摓払偟偨,0
444,亂偡偛偔桳柤恖亃,僼僅儘儚乕偑5枩偵摓払偟偨,0
445,亂僀儞僼儖僄儞僒乕亃,僼僅儘儚乕偑10枩偵摓払偟偨,0
446,亂枮偨偝傟備偔彸擣亃,偄偄偹偑1壄偵摓払偟偨,0
447,亂儂僢僩側抏枊彈巕亃,偄偄偹偑10壄偵摓払偟偨,0
448,亂悽奅偑拲栚偡傞彈亃,偄偄偹偑50壄偵摓払偟偨,0
449,亂侾侽侽亾僋儕傾両亃,偙偺幚愌埲奜偺偡傋偰偺幚愌傪僋儕傾偟偨,0
450,僨乕僞偑偁傝傑偣傫,NULL,0
451,傾僯儅儖僐儈儏僯僥傿偺斈梡傾僶僞乕丅,彫偝偔偰摦偒傗偡偄偑抏枊偼扨弮丅,0
452,嵟傕晛曊揑側僓僐儐僯僢僩丅,擌傗偐偟偺僓僐偑梸偟偄帪偵偲傝偁偊偢屇傃弌偝傟傞丅,0
453,彫偝側僂僒僊宆僓僐儐僯僢僩丅,屒撈傪寵偄丄孮傟傪惉偡惈幙偑偁傞丅,0
454,僸僣僕宆僓僐儐僯僢僩丅,楍傪惉偟偰墶愗傞偝傑傪尒傞偲柊婥傪桿傢傟傞丅,0
455,僷儞僟宆斈梡傾僶僞乕丅,堖憰偼僇儔乕僶儕僄乕僔儑儞偑懠偵傕偁傞傜偟偄丅,0
456,僱僐宆斈梡傾僶僞乕丅,對偺傛偆側怗傝怱抧偺傢傝偵峌寕揑丅,0
457,戝宆偺僀僰宆傾僶僞乕丅,峌杊偵桪傟偰偄傞傛偆側尒偨栚偩偑弬偼偍忺傝丅,0
458,庤偵擖傟傞偲壗屘偐惛恄忬懺偑夵慞偡傞,撲偺傾僀僥儉傪塣傇儐僯僢僩丅,0
459,傾僀僥儉僉儍儕傾乕偵傑偲傢傝偮偄偰偄傞偙偲偑偁傞儐僯僢僩丅,儔僀僼偑懌傝側偔偰彑偰側偄偲偒偵栶偵棫偮丅,0
460,傕偪傕偪偹偹偪傖傫偍婥偵擖傝偺僋儅恖宍丅,壗恖偱傕書偒拝偔偙偲偑偱偒傞嬃堎揑側僒僀僘丅,0
461,摦暔偺偸偄偖傞傒偑戝岲偒側彈偺巕丅,怮傞偲偒偼枅廡俈旵偺偸偄偖傞傒傪儘乕僥乕僔儑儞偟偰書偒偟傔傞丅,0
462,嬻傪旘傇儅僇儘儞偺僓僐儐僯僢僩丅,彮偟巁枴偺偁傞撈摿側枴傢偄丅,0
463,偔傞偔傞夞傞僋僢僉乕偺僓僐儐僯僢僩丅,僀僠僑僕儍儉偑楙傝崬傫偱偁傞丅,0
464,梩偭傁偱塇偽偨偄偰旘傇僇僢僾働乕僉宆儐僯僢僩丅,僾儗乕儞偩偑怘傋偰偄偰朞偒側偄丅,0
465,儈儞僩傪僾儘儁儔偺傛偆偵夞偟偰旘傇傾僀僗僋儕乕儉丅,偪傚偭偲崅媺姶偺偁傞僩僢僺儞僌丅,0
466,彫偝側僛儕乕宆僓僐儐僯僢僩丅,僾儔僗僠僢僋偺梕婍偵擖偭偰偄偨丅,0
467,係偮偺姶忣偺婄傪帩偮傠偆偦偔宆儐僯僢僩丅,婄偵傛傞抏枊偺堘偄偼側偄丅,0
468,戝偒側僾儕儞宆儐僯僢僩丅,扤偵傕庢傜傟偨偔側偄掕斣偺娒枴丅,0
469,嫄戝僷儞働乕僉偵忔偭偐偭偨僜僼僩僋儕乕儉宆儐僯僢僩丅,娒偄傕偺偱偍暊傪枮僞儞偵偟偨偄恖偵丅,0
470,僷儞働乕僉偵嶶傝偽傔傜傟偨僶僞乕偺儐僯僢僩丅,NULL,0
471,傑偳偐摿惢儂乕儖働乕僉宆儃僗儐僯僢僩丅,偙偙偱偼枅擔偑僴僢僺乕僶儗僢僩僨乕丅,0
472,娒偄傕偺傪嶌傞偺傕怘傋傞偺傕戝岲偒側彈偺巕丅,偨偔偝傫嶌傝夁偓偰偟傑偆偺偱怘傋夁偓偰偟傑偆丅,0
473,僔儏乕僥傿儞僌僎乕儉偺帺婡宆傾僶僞乕丅,嵟掅尷偺憰旛偩偑榬慜師戞偱偳偙傑偱傕怤峌偱偒傞丅,0
474,拞宆偺旘嬻掵宆儐僯僢僩丅,庡挘偟側偄奃怓偺儃僨傿偱斈梡惈偵桪傟傞丅,0
475,晄巚媍側椡偱嬻傪旘傇偲偄偆涋彈宆傾僶僞乕丅,揋傪捛旜偡傞僔儑僢僩偑摼堄丅,0
476,杺朄巊偄宆斈梡傾僶僞乕丅,杮婥傪弌偣偽嬌懢偺儗乕僓乕傪曻偰傞丅,0
477,柤嶌僔儏乕僥傿儞僌偺戝儃僗傪柾曧偟偨儐僯僢僩丅,尨揟傛傝傕抏枊偑峊偊傔傜偟偄丅,0
478,僎乕儉僐儈儏僯僥傿偵嶶傝偽傔傜傟偨彫宆朇戜丅,NULL,0
479,僎乕儉僐儈儏僯僥傿偵嶶傝偽傔傜傟偨戝宆楢憰朇戜丅,NULL,0
480,僪儔僑儞宆嫄戝旘峴愴娡丅,梼偼尒偨栚傛傝壜摦堟偑嫹偄丅,0
481,嶗嶁浠乆壴僆儕僕僫儖偺儃僗儐僯僢僩丅,僆僾僔儑儞僷乕僣偱憰旛傪憹嫮偱偒傞丅,0
482,僔儏乕僥傿儞僌僎乕儉偵惛捠偟偨僗僩儕乕儅乕丅,崱偼乽偳傫偳傫傁偭偪乿偺僗僐傾慡堦傪慱偭偰偄傞丅,0
483,摢晹偑僗僋儕儏乕偵側偭偨僪儘儁儔偺垷庬丅,崅懍偱悈拞傪嬱偗傞丅,0
484,僋儕僆僱宆僓僐儐僯僢僩丅,岥偑奐偄偨偲偒偺傒僟儊乕僕傪庴偗晅偗傞丅,0
485,僋儔僎宆僓僐儐僯僢僩丅,廤抍偱僕僌僓僌偵塲偖丅,0
486,奀懐儁儞僊儞偺斈梡傾僶僞乕丅,偙偺傾僶僞乕偩偗偱廤傑偭偨傜乽奀懐抍乿偲屇偽傟傞丅,0
487,妟偵曮愇偺傛偆側晹埵傪帩偮僂僫僊宆儐僯僢僩丅,NULL,0
488,墿怓偔偰娵偄愽悈娡宆儐僯僢僩丅,娡撪偱偼梲婥側壧偑棳傟偰偄傞丅,0
489,嫄戝僄僀宆儐僯僢僩丅,僆僯僀僩儅僉僄僀偲僗僥儖僗愴摤婡偺岎攝庬丅,0
490,僋儔僎偺傒偯偒偑憖傞嫄戝僋儔僎宆儐僯僢僩丅,俇杮偺怗榬偼崅偄嵞惗椡傪帩偮丅,0
491,悈偲悈惐惗暔偑岲偒側彈偺巕丅,悈傪傆傢傆傢塲偖偺偑岲偒偱惈奿傕傆傢傆傢偟偰偄傞丅,0
492,偄偄偹偑怢傃擸傫偱怱偑旀暰偟偨抏枊彈巕偺嬤偔偵尰傟傞,恖嵃宆僓僐儐僯僢僩丅,0
493,僑僗儘儕恖宍宆僓僐儐僯僢僩丅,拝偣懼偊偵偙偩傢傝傪帩偮抏枊彈巕傕偄傞偲偐丅,0
494,搷怓偺挶宆斈梡傾僶僞乕丅,尰幚傪朰傟偨偄恖偵恖婥偑偁傞丅,0
495,戝偒側栚傪帩偮媴懱宆儐僯僢僩丅,懳洺偡傞幰偺梸朷傪尒敳偔偲偄偆愝掕丅,0
496,巰恄宆斈梡傾僶僞乕丅,庤偑柍偔偰姍傪帩偰側偄栤戣偼嬤擔傾僢僾僨乕僩梊掕丅,0
497,旉怓偺壴傪実偊傞晜搰宆儐僯僢僩丅,壴尵梩偼乽桱烼乿丅,0
498,奊巕偺僆儕僉儍儔偑嫄戝恖宍偵側偭偨丅,傕偪傕偪偹偹偪傖傫偑儐僯僢僩嶌惉偵嫤椡丅,0
499,奊巕偺帺幒傪寭偹偨儃僗儐僯僢僩丅,扤偐偑晹壆偵棃傞傪懸偭偰偄傞偑搩偵偼奒抜偑柍偄丅,0
500,扤偐偵峔偭偰梸偟偔偰帺暘傪攈庤偵拝忺偭偨彈偺巕丅,娭傢偭偨恖偼斵彈偺儚僈儅儅偝偵旀暰偟偰偟傑偭偨偲偄偆丅,0
501,奊巕偺僆儕僕僫儖僉儍儔僋僞乕恖宍偱偁傝丄,桞堦柍擇偺僀儅僕僫儕乕僼儗儞僪丅,0
502,僐儈僇儖側塅拡恖偺忔傝暔晽儐僯僢僩丅,偙傟傪尒偰傕抏枊彈巕偼扤傕嬃偐側偄丅,0
503,偄偄偹儃僞儞偵帡偰偄傞偐傜偙偺柤偱屇偽傟偰偄傞偑丄,杮摉偼晛捠偺僴乕僩儅乕僋傪柾偟偨儐僯僢僩丅,0
504,墿怓偄壴宆僓僐儐僯僢僩丅,榖偟偐偗傞偲岥墭偔曉帠傪偡傞丅,0
505,抏偺忋偱岻傒偵僶儔儞僗傪偲傞僋儅宆僓僐儐僯僢僩丅,廃傝偺屄懱偵崌傢偣偰戉楍傪慻傓丅,0
506,僂僒僊偺杺朄彮彈宆傾僶僞乕丅,杺朄偺儘僢僪傪俀杮帩偮梸挘傝偝傫丅,0
507,嶰擔寧偺堉巕偵屪偭偨杺彈宆傾僶僞乕丅,堉巕偺備傝偐偛偺傛偆側嵗傝怱抧偼柊婥傪桿偆偲偄偆丅,0
508,揤偵枮揰偺抏枊傪塮偟弌偡僾儔僱僞儕僂儉丅,NULL,0
509,備傔傒傞儉僂偺恊桭偺彈偺巕丅,悽奅丒塅拡偺杮幙偑壢妛揑偵夝偒柧偐偝傟傞擔傪柌尒偰偄傞丅,0
510,婾暔偺寧偵媅懺偡傞偙偲偺偱偒傞儃僗儐僯僢僩丅,尒傛偆偵傛偭偰偼寧偵傕懢梲偵傕尒偊傞丅,0
511,彨棃偺柌偼塅拡旘峴巑偲偄偆柌尒傞彮彈丅,枅斢抏枊偺柌傪尒偰偟傑偆傎偳偺抏枊嫸丅,0
512,椪婡墳曄偵攝抲傪曄偊偰懳徾傪徠傜偡偙偲偑偱偒傞,儔僀僩晅偒僪儘乕儞丅,0
513,侾俆擭慜偵儕儕乕僗偝傟偰掕斣偲側偭偨,儃乕僇儖壒尮偺僉儍儔僋僞乕傪柾偟偨斈梡傾僶僞乕丅,0
514,堦娽儗僼僇儊儔偲摨摍偺婡擻傪帩偮僪儘乕儞丅,偙傟傪屇傃弌偣偽娙扨偵帺嶣傝偑偱偒傞丅,0
515,搒夛晽偺彫恖宆僓僐儐僯僢僩丅,幵傛傝傕憗偔憱傞偙偲偑偱偒傞崅惈擻僗働乕僩儃乕僪傪憖傞丅,0
516,僗僺乕僇乕偵幵椫偑偮偄偨儐僯僢僩丅,崅懍偱憱傞偺偱挳偔応強偵傛偭偰壒掱偑曄傢偭偰偟傑偆丅,0
517,偨偔偝傫偺僗僺乕僇乕傪実偊偨愴幵丅,僉儍僞僺儔偺壒偑偆傞偝偄偺偱晄昡丅,0
518,僶儗僢僩乕僋岞幃偺攝怣斣慻偱巊傢傟傞儔僀僽僩儗乕儔乕丅,壖憐嬻娫側偺偱傾儞僥僫偼偨偩偺忺傝丅,0
519,嬻惎僋儕儉愱梡偺憱傞儔僀僽僗僥乕僕丅,NULL,0
520,嬻惎僔傾儞愱梡偺憱傞儔僀僽僗僥乕僕丅,NULL,0
521,僋儕儉仌僔傾儞愱梡偺嬻旘傇儔僀僽僗僥乕僕丅,NULL,0
522,憃巕偺儃乕僇儖壒尮僉儍儔僋僞乕偺巓丅,扤偱傕帺桼偵挐傜偣傞偙偲偑偱偒傞丅,0
523,憃巕偺儃乕僇儖壒尮僉儍儔僋僞乕偺枀丅,惈奿偼巊梡幰偛偲偵旝柇偵堎側傞丅,0
524,戉楍傪惉偟偰峌傔傞僓僐儐僯僢僩丅,偨偩慜恑偡傞僾儘僌儔儉偟偐慻傑傟偰偄側偄偺偱巭傑傟側偄丅,0
525,偳偙偐傜偲傕側偔弌尰偡傞儊僀僪宆僓僐儐僯僢僩丅,廤抍偱屌傑偭偰峴摦偡傞丅,0
526,僋僀乕儞忛偵懡悢攝旛偝傟偨朇戜晅偒栘憿愴幵丅,NULL,0
527,僋僀乕儞忛傪庣岇偡傞帺摦朇寕搩丅,NULL,0
528,摿掕偺抏枊彈巕偺嫇摦傪僀儞僾僢僩偟偰妛廗偡傞儃僢僩丅,妛廗嵪傒偺儃僢僩偼偄偔傜偱傕僐僺乕偱偒傞丅,0
529,僋僀乕儞偑嶌傝弌偟偨抏枊彈巕儃僢僩丅,崅偄峌寕惈偲懴媣惈傪帩偮丅,0
530,壱摥偝偣傞偲偄偄偹僼僅儘儚乕傪柍恠憼偵憹傗偟懕偗傞柌偺儐僯僢僩丅,壗偱傕側偄幰傪惁偄懚嵼偺傛偆偵尒偣傞偵偼廫暘側岠壥偩偭偨丅,0
531,儔僀僋僪儕乕儅乕傪夵憿偟偰峌寕摿壔宆偵偟偨儐僯僢僩丅,撍娧偱嶌偭偨偣偄偐僶僌偱悢帤傪憹傗偡婡擻偵栤戣偑偁傞丅,0
532,婾傝偺悢帤偱僶儗僢僩乕僋偺僋僀乕儞偵側偭偨揤嵥僴僢僇乕丅,彑棙偲桪墇姶偵懳偡傞幏拝偑扤傛傝傕嫮偄丅,0
533,偦偙偵擖偭偨幰傪扤偵傕晧偗側偄抏枊彈巕偵夵憿偟偰偟傑偆儃僗儐僯僢僩丅,NULL,0
534,戝偒側攕杒姶偐傜棃傞斀摦偱彑棙傊偺幏拝偑旍戝壔偟丄,帺傜傪夵憿偟偰嵟嫮偺抏枊彈巕傊偲惗傑傟曄傢偭偨丅,0
535,崟墧昅宆僓僐儐僯僢僩丅,愭摢偑昤偄偨慄傪側偧傞傛偆偵摦偔丅,0
536,愒墧昅宆僓僐儐僯僢僩丅,抏枊彈巕栚妡偗偰摦偔丅,0
537,傕偪傕偪偹偹偪傖傫偺偍婥偵擖傝僋儅恖宍丅,幚偼偙偪傜偑僆儕僕僫儖丅,0
538,僒僋儔僪儘儁儔偺彫宆検嶻斉丅,僆僾僔儑儞僷乕僣偼尰嵼奐敪拞丅,0
539,偳傫側巇帠傕堦弖偱廔傢傜偣傞偲偄偆儊僀僪宆傾僶僞乕丅,NULL,0
540,尒偊側偄攇摦傪尒摟偐偡偲偝傟傞僂僒僊彮彈宆傾僶僞乕丅,NULL,0
541,夋壠彮彈宆斈梡傾僶僞乕丅,壖憐僉儍儞僶僗偵壖憐奊昅偱奊傪昤偔丅,0
542,僴僢僺乕僶儗僢僩僿儖働乕僉偑彫偝偄僒僀僘偵側偭偨丅,偙傟偱傕廫暘偵嫄戝偱偁傞丅,0
543,揤枮嫶僸僫僐偺傾僶僞乕宆偺挻嫄戝儃僗儐僯僢僩丅,恎偵拝偗偨僶僢僕偼愄僀儔僗僩傪扴摉偟偨僎乕儉偺僉儍儔僋僞乕丅,0
544,揤枮嫶僸僫僐偺昤偄偨傾僞儕慄偑偦偺傑傑儐僯僢僩偵側偭偨丅,庤敳偒偱偼側偔傛傝椙偄嶌昳偺偨傔偺巚峫嶌嬈傜偟偄丅,0
545,桳椡側奊巘偑昡壙偺偨傔偵昤偒偨偔傕側偄戣嵽傪昤偔嬯偟傒傪昞尰偟偨嶌昳,乧偲揤枮嫶僸僫僐偼愢柧偟偰偄傞丅,0
546,抏枊偵嫮偄僐僗僾儗僀儎乕偺桭恖傪,偦偺応偱揔摉偵昤偄偰彚姭偟偨儐僯僢僩丅,0
547,條乆側婄傪帩偮庱偩偗偺斈梡僉儍儔僋僞乕丅,帪偵攷幆偱帪偵嬸撦丅,0
548,栚偐傜堫嵢偺傛偆側攇摦傪旘偽偡戝僈僄儖偺儐僯僢僩丅,NULL,0
549,梔弍偱戝偒側敋晽傪惗傒弌偡壔偗屜偺儐僯僢僩丅,NULL,0
550,揤枮嫶僸僫僐偍婥偵擖傝偺憃巕儃乕僇儖僉儍儔僋僞乕丅,愭傎偳姰惉偟偨傎傗傎傗偺怴嶌僀儔僗僩丅,0
551,昡壙偑怢傃擸傓旀傟偐傜彸擣梸媮偺嵃偑嬶尰壔偟偨壗偐丅,旀傟壥偰傞傑偱偁傜備傞峌寕傪庴偗晅偗側偄丅,0
552,揤枮嫶僸僫僐偺傾僶僞乕偺僒乕價僗僔儑僢僩丅,嵟屻偵傕娭傢傜偢尒偨栚偱廤拞椡傪偐偒棎偡丅,0
553,億僢僾偱僙僋僔乕側嶌晽偵偙偩傢傞掙曈奊巘丅,帺傜偺傾僶僞乕偼帺暘帺恎偱僨僓僀儞偟偨丅,0
554,嬻偒,NULL,0
555,嬻偒,NULL,0
