0,Ver 2.00,NULL,0
1,Copyright 2021-2023 Outside Sotonohito.,NULL,0
2,僥僉僗僩偺僥僗僩偩傛傫,偪傖傫偲昞帵偝傟偰傞偐尒偲偄偰偹乣,0
3,偳傕乣僶僯儔偁傝偡偱偡両,僐僗僾儗儊僀儞偱抏妶偟偰傑偡偺偱傛傠偟偔両,0
4,備傝怱垽乮偙偙偁乯偱偡,摦暔偵椺偊傞偲崟擫偐側乧丠,0
5,変偼倀俰俙俲俷偲偄偆,抏枊偺媄岻側傜偍擟偣偁傟,0
6,亂儚僀僪僼僅乕儉亃,僔儑僢僩傪峀偄妏搙偵揥奐偡傞,0
7,亂儂乕儈儞僌僼僅乕儉亃,揋傪捛旜偡傞僔儑僢僩傪寕偮,0
8,亂儘僢僋僆儞僼僅乕儉亃,揋偺曽岦偵岦偗偰儈僒僀儖傪寕偮,0
9,亂僼僅乕僇僗僼僅乕儉亃,惓柺偵岦偗偰廤拞揑偵儈僒僀儖傪寕偮,0
10,亂僉儍儘僢僩僽儔僗僞乕亃,價僢僩偑岦偔曽岦偵儃儉傪曻偮,0
11,亂價價僢僪僌儗僱乕僪亃,僾儗僀儎乕偺惓柺偵儃儉傪曻偮,0
12,亂僼儘儞僩僼僅乕儉亃,惓柺偵岦偗偰僔儑僢僩傪寕偮,0
13,亂僗儔僀僪僼僅乕儉亃,嵍塃偵堏摦偡傞偲僔儑僢僩偺岦偒偑曄傢傞,0
14,亂僼僅乕僇僗僼僅乕儉亃,惓柺偵岦偗偰廤拞揑偵儈僒僀儖傪寕偮,0
15,亂儂乕儈儞僌僼僅乕儉亃,揋傪捛旜偡傞儈僒僀儖傪寕偮,0
16,亂僗僥傿儞僌儚乕僘亃,價僢僩偐傜崅埿椡偺抏傪楢幩偡傞,0
17,亂僟乕僋儔儞儁乕僕亃,堦掕帪娫僔儑僢僩偲儈僒僀儖偺埿椡偑戝暆偵忋偑傞,0
18,亂僗儔僀僪僼僅乕儉亃,嵍塃偵堏摦偡傞偲僔儑僢僩偺岦偒偑曄傢傞,0
19,亂僼儘儞僩僼僅乕儉亃,惓柺偵岦偗偰僔儑僢僩傪寕偮,0
20,亂僼傿僢僋僗僼僅乕儉亃,掅懍儌乕僪偺娫價僢僩偺岦偒傪屌掕偡傞,0
21,亂僗僞儞僶僀僼僅乕儉亃,掅懍儌乕僪偺娫價僢僩偺埵抲傪屌掕偡傞,0
22,亂僼儗僀儈儞僌僴僢僋亃,夋柺慡懱傪峀偔峌寕偡傞,0
23,亂僠乕僩僶儕傾亃,僾儗僀儎乕偺廃埻偵僶儕傾傪揥奐偡傞,0
24,亂僔乕儖僪嫮壔亃乮弶怱幰岦偒乯,僔乕儖僪攋夡帪偺儊儞僞儖儗儀儖尭彮悢偑彮側偄,0
25,亂僔儑僢僩嫮壔亃,崅懍儌乕僪帪偺僔儑僢僩埿椡偑忋徃偡傞,0
26,亂儈僒僀儖嫮壔亃,掅懍儌乕僪帪偺儈僒僀儖埿椡偑忋徃偡傞,0
27,亂僟僽儖嫮壔亃乮弉楙幰岦偒乯,僔儑僢僩偲儈僒僀儖偺埿椡偑忋徃偡傞偑僔乕儖僪偑揥奐偝傟側偄,0
28,憰旛偼偙傫側姶偠偱偄偄偐側丠,NULL,0
29,偙傟偱戝忎晇丠傕偆偪傚偭偲峫偊捈偡乧丠,NULL,0
30,嶌愴偼偙傟偱傛偄偩傠偆偐丠,NULL,0
31,BGM偺壒検傪愝掕,NULL,0
32,SE偺壒検傪愝掕,NULL,0
33,僥僉僗僩尵岅偺曄峏,NULL,0
34,僨乕僞僂傿儞僪僂偺昞帵愝掕,NULL,0
35,僎乕儉愝掕傪奐偔,NULL,0
36,夋柺愝掕傪奐偔,NULL,0
37,僉乕僐儞僼傿僌傪奐偔,NULL,0
38,僠儏乕僩儕傾儖傪僾儗僀偡傞,NULL,0
39,愝掕傪曐懚偟偰僞僀僩儖偵栠傞,NULL,0
40,CONSUMER丗掅懍僉乕偱掅懍,ARCADE丗僔儑僢僩楢懪or楢幩偱崅懍丒僔儑僢僩挿墴偟偱掅懍,0
41,1UP傾僀僥儉傪僪儘僢僾偡傞僿儖僾僉儍儔僋僞乕偺弌尰悢傪愝掕,NULL,0
42,愝掕傪弶婜壔,NULL,0
43,愝掕傪曐懚偟偰栠傞,NULL,0
44,嬻偒,NULL,0
45,嬻偒,NULL,0
46,嬻偒,NULL,0
47,嬻偒,NULL,0
48,乮忦審傪枮偨偡偲愝掕壜擻乯,NULL,0
49,嬻偒,NULL,0
50,偙傫偵偪偼,抏枊宯俽俶俽乽僶儗僢僩乕僋乿僒億乕僩傾僇僂儞僩偱偡,0
51,偙傟傛傝僠儏乕僩儕傾儖傪奐巒偟傑偡,NULL,0
52,僉乕憖嶌偵偍崲傝偱偟偨傜,夋柺嵍壓偵偰偛埬撪偟偰偍傝傑偡,0
53,僎乕儉僷僢僪偺僉乕愝掕偼億乕僘儊僯儏乕傛傝,僉乕僐儞僼傿僌偐傜峴偊傑偡,0
54,偦傟偱偼夋柺偺埬撪偵廬偭偰,憖嶌傪妋擣偟偰偔偩偝偄,0
55,傛傠偟偄偱偡偹,NULL,0
56,懕偄偰峌寕曽朄偺愢柧偱偡,NULL,0
57,僔儑僢僩僉乕傕偟偔偼楢幩僉乕傪,挿墴偟偡傞偙偲偱僔儑僢僩傪敪幩偱偒傑偡,0
58,僔儑僢僩僉乕傪楢懪傕偟偔偼楢幩僉乕傪挿墴偟偱,僔儑僢僩傪敪幩偱偒傑偡,0
59,弌尰偡傞僞乕僎僢僩傪僔儑僢僩偱攋夡偟偰偔偩偝偄,NULL,0
60,傛偔偱偒傑偟偨,NULL,0
61,懕偄偰掅懍儌乕僪偺愢柧傪偄偨偟傑偡,NULL,0
62,掅懍僉乕傪墴偟偰偄傞娫偼,僾儗僀儎乕偺堏摦偑抶偔側傝傑偡,0
63,僔儑僢僩僉乕傪儂乕儖僪偟偰偄傞娫偼,僾儗僀儎乕偺堏摦偑抶偔側傝傑偡,0
64,偙偺忬懺偱敪幩偱偒傞儈僒僀儖偼,懴媣椡偺崅偄揋偵懳偟偰岠壥揑偱偡,0
65,掅懍儌乕僪偲儈僒僀儖傪妶梡偟側偑傜,僞乕僎僢僩傪攋夡偟偰偔偩偝偄,0
66,忋庤偱偡偹,NULL,0
67,師偼揋傕抏傪敪幩偟傑偡,NULL,0
68,僾儗僀儎乕偺拞怱偵尒偊傞娵偄儅乕僋偵摉偨傜側偄傛偆偵,揋抏傪旔偗偰偔偩偝偄,0
69,抏偺僗僉儅傪尒嬌傔偨偄偲偒偼,掅懍儌乕僪傪妶梡偟偰偔偩偝偄,0
70,偦傟偱偼抏偵摉偨傜偢偵,偡傋偰偺僞乕僎僢僩傪攋夡偟偰偔偩偝偄,0
71,摉偨偭偰偟傑偄傑偟偨偹,僐僣傪捦傓傑偱傕偆堦搙傗偭偰傒傑偟傚偆,0
72,戝曄傛偔偱偒傑偟偨,NULL,0
73,偙偙傑偱偺傑偲傔傪宖帵偟傑偡,NULL,0
74,懕偄偰亀儊儞僞儖僎乕僕亁偺愢柧偱偡,NULL,0
75,僔儑僢僩傪摉偰偨傝揋傪搢偟偨傝偡傞偲,僾儗僀儎乕廃埻偺儊儞僞儖僎乕僕偑拁愊偝傟傑偡,0
76,僎乕僕偼揋偲偺嫍棧偑嬤偄傎偳憗偔棴傑傝傑偡,NULL,0
77,僎乕僕偑棴傑傞傑偱揋傪搢偟偰偔偩偝偄,NULL,0
78,僎乕僕偑拁愊偝傟傞偲,亀儊儞僞儖儗儀儖亁偑忋偑傝傑偡,0
79,儊儞僞儖儗儀儖偑忋偑偭偰偄傞娫偵,揋抏偵摉偨傞偲偳偆側傞偱偟傚偆丠,0
80,僔乕儖僪偑敪摦偡傞偺偱儔僀僼偑尭傝傑偣傫,NULL,0
81,偟偐偟儊儞僞儖儗儀儖偼尭偭偰偟傑偄傑偡偺偱,壜擻側尷傝儊儞僞儖儗儀儖侾埲忋傪曐偮偲椙偄偱偟傚偆,0
82,師偼嫮椡側媄傪徯夘偟傑偡,NULL,0
83,儊儞僞儖儗儀儖偑忋偑傞傾僀僥儉傪偍搉偟偟傑偡偺偱,庢摼偟偨屻偵儃儉僉乕傪墴偟偰傒偰偔偩偝偄,0
84,敪摦偡傞慜偵旐抏偟偰偼偄偗傑偣傫,傕偆堦搙傾僀僥儉傪嵎偟忋偘傑偡,0
85,儃儉偑敪摦偟傑偟偨偹,偙傟偼揋抏傪徚偟側偑傜柍揋忬懺偵側傞偙偲偑偱偒傑偡,0
86,偙偙傑偱偺傑偲傔傪宖帵偟傑偡,NULL,0
87,僔儑僢僩傗儃儉偵偼條乆側庬椶偑偁傝傑偡偺偱,偍岲傒偵僇僗僞儅僀僘偟偰帋偟偰傒偰偔偩偝偄,0
88,嵟屻偵戝帠側愢柧傪偄偨偟傑偡,NULL,0
89,僾儗僀儎乕偺僾儗僀儞僌偵傛偭偰,懠偺儐乕僓乕偐傜偄偄偹傪栣偭偨傝,0
90,僼僅儘乕偟偰傕傜偭偨傝偡傞偙偲偑偁傞偱偟傚偆,NULL,0
91,偙傟傜偼夋柺塃偵悢抣偲偟偰拁愊偝傟傑偡,NULL,0
92,旐抏偣偢偵楢懕偟偰偄偄偹傗僼僅儘儚乕偑憹偊懕偗偰,僶僘傞乧嬶懱揑偵偼亀僶僘僎乕僕亁偑儅僢僋僗偵側傞偲,0
93,妝偟偄偙偲偑婲偙傞偐傕偟傟傑偣傫偹,NULL,0
94,偦傟偱偼妝偟偄抏枊儔僀僼傪,NULL,0
95,嬻偒,NULL,0
96,亂僆乕僩僼傿乕僶乕亃,僶僘僎乕僕偑嵟戝偵側傞偲懄帪僶僘僼傿乕僶乕偑敪摦偡傞,0
97,亂儅僯儏傾儖僼傿乕僶乕亃,僶僘僎乕僕嵟戝帪偵儃儉僉乕偱僶僘僼傿乕僶乕偑敪摦偡傞,0
98,嬻偒,NULL,0
99,嬻偒,NULL,0
100,儂儞僩偺偙偲尵偭偨偩偗偱偟傚乣偑乣両,偙偆側偭偨傜慡堳傗偭偮偗偰傗傞両,0
101,偁偺僈僉傫偪傚僋僀乕儞乧,儂儞僩惗堄婥偹乧,0
102,僋僀乕儞傔僐僔儍僋側庤傪巊偄偍偭偰乧両,弆惔偟偰偔傟傞両,0
103,偐傢偄偄僂僒僊偝傫傒偂乣偮偗偨両,僉儈偑偍偨偢偹幰傜偟偄偹丠,0
104,偍偰傫偽側僱僐偝傫傒偂乣偮偗偨両,偄偐偵傕僀僞僘儔岲偒偦偆偩偹丠,0
105,僷儞僟偝傫傒偭偗両,乧偱傕僷儞僟偠傖側偔偰僠乕僞乕偝傫丠,0
106,偁側偨偑偙偺僐儈儏僯僥傿偺儃僗偱偡偹丠,巹偼嫮偄偱偡傛両,0
107,傆傫乧偁側偨側傫偐傛傝,巹偺傎偆偑傛偭傐偳嫮偔偰枺椡揑傛,0
108,巊偊傞傕偺傪巊偭偰壗偑埆偄丠,偁偺僋僀乕儞偵斾傋傝傖偐傢偄偄傕傫傛,0
109,偙偺偹偹偪傖傫偑晧偗傞側傫偰乣両,NULL,0
110,偆傢乣偍偄偟偦乣両,偱傕尭検拞側傫偱偡傛偹乧偰傊傊,0
111,偐傢偄傜偟偄僐儈儏偹乧,桿榝偵晧偗偪傖偄偦偆乧,0
112,娒偭偨傞偄偍壻巕偽偐傝偠傖側乧,変偼億僥僠偑偁傟偽廫暘偠傖偑側,0
113,崱擔偺僨僓乕僩偼儅僔儏儅儘働乕僉偩傛偭両,僞乕僎僢僩偝傫妎屽両,0
114,崱擔偺僨僓乕僩偼乕丠,儔僘儀儕乕働乕僉偱寛傑傝偩偹偭両,0
115,崱擔偼枙拑働乕僉偑偄偄偐側丠,偦傟偲傕埱恗摛晠偵偟傛偆偐側丠,0
116,儅僔儏儅儘偩偄偡偒両,愭偵偍暊嬻偐偣偪傖偄傑偟傚両,0
117,巆擮乧儔僘儀儕乕偼寵偄傛,NULL,0
118,偍慜偺怘偄傕傫側傫偧偵嫽枴偼柍偄傢偄両,NULL,0
119,傂偳乕偄両,僨僓乕僩偁偘側偄傕傫偹偭両,0
120,僎乕儉偼戝岲偒側傫偱偡乣,乽偳傫偳傫傁偭偪乿岲偒側恖偄傞偐側乣丠,0
121,巹偵僎乕儉偱彑偰傞偲偍巚偄丠,NULL,0
122,偐偮偰変傪捛偄弌偟偨僐儈儏僯僥傿偠傖,偙偙偄傜偱曬暅偲偄偙偆偐,0
123,偙傫傝傝両,崱夞偺僞乕僎僢僩偼偁傝偡偝傫両丠,0
124,偙傫傝傝両崱夞偺攝怣偼,惗堄婥側僞乕僎僢僩偵抪傪偐偐偣偰傗傞偧侓,0
125,偙傫傝傝乧偁偭両,偁傫偨偼傕偆偍屇傃偱側偄両,0
126,浠乆壴偝傫偍傂偝偱偡乣両懳傛傠両,NULL,0
127,帇挳幰偺慜偱嶴傔側巔傪尒偣偰偁偘傞傢乧,NULL,0
128,傆傫両,晧偗傪擣傔傞傑偱偄偨傇偭偰傗傞傢偄両,0
129,傑乕偗乕傑乕偟乕偨乕両,偍偮傝傝偭両,0
130,偛傏偛傏乧偛傏傏傏傏傏傏偭両,偁偭両僶乕僠儍儖側悈拞偼揗傟側偄傫偱偟偨,0
131,傆傫乧僱僐偼悈偑嬯庤側偺傛,NULL,0
132,悈懓娰偵偱傕棃偨婥暘偠傖側乧,儔僢僾僩僢僾傪楳傞偵偼偄偄応強偠傖,0
133,偁側偨傕傆偐傆偐偺僋儔僎偝傫偲,梀傃偵棃偨偺乣丠,0
134,偙傢偄傂偲偵偼乣,僋儔僎偝傫偺撆偑偍帡崌偄偩傛乣,0
135,僋儔僎偝傫傗奀偺僩儌僟僠偵,僀僕儚儖偟偪傖僟儊偩傛乣,0
136,僋儔僎偝傫両丠,傆偐傆偐偲尵偆傛傝僰儊僰儊偠傖側偄偱偡偐丠,0
137,晐偄偩側傫偰怱奜偹乧,偙傫側偵傕枺椡揑側偺偵,0
138,偳偄偮傕偙偄偮傕寲壾偭憗偄偐傜惓摉杊塹偠傖傠,NULL,0
139,傇偔傇偔乣,NULL,0
140,恀偭埫偩乣僆僶働偲偐弌偨傜偙傢偄側乣,NULL,0
141,崟擫偼埮傪嬱偗傞偺乧,抐偠偰埮偵堷偒偙傕偭偰傞傢偗偱偼側偄傢,0
142,偙傟偼柺搢側儎僣偑棃傞梊姶偑偡傞偺偆乧,NULL,0
143,乧偙偙傑偱偍偄偱乧,偁側偨傕庘偟偄偺偱偟傚偆乧丠,0
144,偒偭偲偁側偨傕巹傪僀僕儊傞傫偩乧,NULL,0
145,偹偉乧偍桭払偵側傝傑偟傚偆乧丠,棧傟偪傖偄傗偩傛丠僽儘僢僋偟偪傖偄傗偩傛丠,0
146,偝偭乧両庘偟偔側傫偐偁傝傑偣傫両,乧庘偟偔側傫偐両,0
147,偁傫偨傪僀僕儊偰傕妝偟偔側偄傢乧,帺堄幆夁忚側傫偠傖側偄偺丠,0
148,偁乕偆傞偝偄両,偍慜傒偨偄側廳偨偄儎僣偼偨偩幾杺側偩偗偠傖偄両,0
149,偆傆傆乧巹偺晧偗乧偱傕偪傚偭偲妝偟偐偭偨乧,NULL,0
150,偆偭傢乣両僉儔僉儔乣両両,偢偭偲偙偙偵偄偨偄偱偡偹偉,0
151,僉儔僉儔偟偡偓乧,側傫偩偐摱怱偵曉偭偨婥暘偹乧,0
152,偙偙偵偼偳傫側擼傒偦偍壴敤偑,懸偪庴偗偲傞傫偠傖丠,0
153,偁偭両偍偨偢偹幰僂僒僊両摝偑偝偹偉偧両,NULL,0
154,偢偄傇傫攈庤偵朶傟偰傞偠傖偹偊偐両,偙偺儎儅僱僐両,0
155,偦偙偺僆僆僌儅僱僐両儚僞僔偲彑晧偟傠偭両,NULL,0
156,偊偭僪僐僪僐丠,偁側偨僪僐偵偄傞傫偱偡偐偭両丠,0
157,嶳擫偠傖側偄傢傛乧,NULL,0
158,僐僜僐僜墦偔偐傜尒偲傞搝偵偼晧偗傫偧,NULL,0
159,傗傜傟偨偧偪偔偟傚乕傔両,抏枊偺僴僨偝偵偼帺怣偁偭偨偗偳側乧両,0
160,偼偭傗乣偄両,偙偙傪憱傟偽僋僀乕儞偺偲偙傠偱偡偹乣丠,0
161,晄巚媍偲懱偑摦偄偪傖偆乧,悽奅堦僇儚僀僀崟擫偑壧偭偰傒偨乧椙偄傢偹,0
162,偙偙傜偱媫偖偲偡傞偐偺偆乧,僥儞僔儑儞忋偘偰偄偔偧偄,0
163,僔傾儞偪傖傫両,偁偄偮嫮偄偐傜僨儏僄僢僩偱傗傞傛両,0
164,巭傑傟乕両,僋僀乕儞偝傑偲夛偆慜偵傢偨偟偨偪偑巭傔偰傗傞両,0
165,偍慜偼愨懳捛偄曉偡傛偆偵,僋僀乕儞偝傑偵尵傢傟偰傞偐傜偹両,0
166,崱搙偼傆偨傝偑偐傝偱偡偐偭両丠,NULL,0
167,掹傔偑埆偄僪儔擫偳傕偹乧,NULL,0
168,偍庡傜拞恎偑柍偄偺偆乧,傾僀僣傔壓傜傫傕傫傪嶌傝偍偭偰,0
169,僋僀乕儞偝傑偛傔傫側偝乕偄両僈僋僢両,NULL,0
170,偙偙偑偁偺僋僀乕儞偺崻忛乧両,愨懳晧偗側偄偱偡偭両,0
171,偙偙傑偱慡晹搢偟偰偁偘偨傢乧,偒偭偲偁偺僈僉傫偪傚傕戝偟偨偙偲側偄傢偹,0
172,傛偆傗偭偲拝偄偨傢偄乧崱偵尒偰偍傟両,NULL,0
173,僋僴僴僴両傑偝偐杮摉偵偙偙傑偱棃傞偲偼偹両,柺敀偄懳愴偵側傝偦偆偠傖側偄偐両,0
174,偮傑傜傫搝偲巚偭偰偄偨偑傗傞偠傖側偄偐両,偩偑偙偙偱婱條偺晧偗偩両,0
175,偁偭両偰傔偉両側傫偱幾杺偡傞両,偦傫側彫庤愭偱変偵彑偰傞傢偗側偄偩傠両,0
176,梋桾偐傑偟偨偭偰儉僟偱偡乣両,偙偙偱彑偭偰巹偑僋僀乕儞偵側偭偰傗傝傑偡両,0
177,傗偭傁傝僂僜偲嫊惃偺夠偹乧,杮暔偺嫮偝傪嫵偊偰偁偘傞傢両,0
178,僴僢僉儞僌偱偍慜偛偲偒偵晧偗傞偙偺変偱偼側偄両,挷巕偵忔傞側両,0
179,僙儕僼亀儃僗俉柺俢亁,NULL,0
180,傑偩崀嶲偟側偄偮傕傝偱偡偐丠,挦傝側偄偱偡偹偭両,0
181,摝偘崢側傫偱僟僒偄傢偹乧,寜偔晧偗傪擣傔偨傜傛偐偭偨偺傛,0
182,側傫偠傖偙偺僨僞儔儊偺嬻娫偼乧,柺敀偔側偭偰偒偨傢偄両,0
183,偙偙傑偱変傪攏幁偵偡傞側傫偰乧,儉僇僣僋乧儉僇僣僋両両,0
184,偍慜偵偼乧偍慜偵偼乧両,愨懳偵晧偗側偄乧両,0
185,偙偺嵟嫮偺抏枊偺慜偵,NULL,0
186,媰偒姭偔偑偄偄両,NULL,0
187,乧愨懳偵婱條傪搢偡両,NULL,0
188,変偺姰慡彑棙偩両巰偸偑傛偄両,NULL,0
189,嬻偒,NULL,0
190,嬻偒,NULL,0
191,嬻偒,NULL,0
192,嬻偒,NULL,0
193,偍偍乕両偁傝偡偪傫僆僢僗僆僢僗両,傑偨挦傝偢偵揮惗偟偨傫丠,0
194,偍偭旤彮彈傗両僫僨僫僨偝偣偰乣,NULL,0
195,偳偭偐偵彑庤偵奊昤偄偰偔傟傞,儅僋儘偲偐俙俬偲偐棊偪偰傊傫偐側乕丠僠儔僢,0
196,僸僫僐偝傫偙傫偵偪偼乣両,偣偭偐偔僋僀乕儞偵側偭偨偺偵巆擮偱偡傛乣両,0
197,偁側偨乧奊昤偒偹丠,傢偨偟傪愨悽偺旤彮彈偵昤偄偰偔傟偨傜偄偄傢,0
198,偔偩傜傫乧変偼曋棙壆偱偼側偄偧,NULL,0
199,奊偲抏枊偑椙偐偭偨傜偄偄偹傛傠偟偔側乣両,NULL,0
200,崱搙偼僋儕儉偪傖傫偲偄偭偟傚偵傖乣,僋僀乕儞偝傑傪偍庣傝偡傞偺偵傖,0
201,僋儕儉偪傖傫偑棃偰偔傟偨偐傜傕偆晧偗側偄偺偵傖,NULL,0
202,偆偪偲僋儕儉偪傖傫偑懙偊偽柍揋偩偵傖,NULL,0
203,偆偊乣傫両偁偄偮嫮偡偓偵傖乣両,NULL,0
204,嬻偒,NULL,0
205,崱棳峴偺抏枊宯俽俶俽乽俛倳倢倢倕倲倎倢倠乮僶儗僢僩乕僋乯乿,NULL,0
206,僔儏乕僥傿儞僌僎乕儉偺僾儗僀儞僌偱枺偣傞偲,懠偺儐乕僓乕偐傜偄偄偹偑傕傜偊傞抏枊彈巕偺偨偟側傒偱偁傞,0
207,偦偺拞偱偄偄偹傕僼僅儘儚乕傕僩僢僾傪屩傞儐乕僓乕偼,廃傝偐傜僋僀乕儞偲屇偽傟恖婥傪廤傔偰偄偨,0
208,偟偐偟堦晹偺儐乕僓乕偼僋僀乕儞偵幑搃偟偰,埆岥偵僨儅偵彂偒偨偄曻戣偟偰偄偨,0
209,偙傟偵暊傪棫偰偨僋僀乕儞偺斀寕両,斵彈傜傪抏枊愴偺僞乕僎僢僩偵巇棫偰忋偘偰偟傑偭偨両,0
210,傒傞傒傞偆偪偵戝墛忋両,偁偪偙偪偺僐儈儏僯僥傿偐傜揋偑廝偄妡偐傞両,0
211,寖偟偄抏枊摨巑偺徴撍偵,偆偪彑偮偺偼壥偨偟偰扤側偺偐乧両,0
212,嬻偒,NULL,0
213,僐儞僩儘乕儔儃僞儞昞帵偺曄峏,NULL,0
214,忋堏摦,NULL,0
215,壓堏摦,NULL,0
216,塃堏摦,NULL,0
217,嵍堏摦,NULL,0
218,寛掕,NULL,0
219,僉儍儞僙儖,NULL,0
220,僔儑僢僩,NULL,0
221,儃儉,NULL,0
222,僔儑僢僩楢幩,NULL,0
223,掅懍儌乕僪,NULL,0
224,億乕僘儊僯儏乕,NULL,0
225,僨僼僅儖僩愝掕偵栠偡,NULL,0
226,愝掕傪曐懚偟偰栠傞,NULL,0
227,嬻偒,NULL,0
228,僗僥乕僕偺慖戰,乮慖戰壜擻側僗僥乕僕偺傒乯,0
229,擄堈搙偺慖戰,乮儊僀儞儌乕僪偱慖戰壜擻側擄堈搙偺傒乯,0
230,僇僂儞僞乕儌乕僪偺愝掕,乮僇僂儞僞乕儌乕僪夝嬛帪偺傒愝掕壜擻乯,0
231,僗僺乕僪儔儞偺愝掕,乮僗僺乕僪儔儞夝嬛帪偺傒愝掕壜擻乯,0
232,僗僥乕僕奐巒抧揰偺愝掕,NULL,0
233,儊儞僞儖儗儀儖弶婜抣偺愝掕,NULL,0
234,儊儞僞儖僎乕僕弶婜抣偺愝掕,NULL,0
235,僶僘僎乕僕弶婜抣偺愝掕,NULL,0
236,埲忋偺愝掕偱楙廗奐巒,NULL,0
237,僾儗僀儎乕僙儗僋僩偵栠傞,NULL,0
238,両慖戰晄擻側擄堈搙傪慖戰偟偰偄傞偨傔奐巒偱偒傑偣傫両,NULL,0
239,僼儖僗僋儕乕儞偺愝掕,乮僉乕儃乕僪F4僉乕偱傕曄峏壜擻偱偡乯,0
240,僼儗乕儉儗乕僩偺愝掕,乮壓偘傞偲帇擣惈偑棊偪傑偡偑摦嶌偑夣揔偵側傞壜擻惈偑偁傝傑偡乯,0
241,悅捈摨婜偺愝掕,乮僎乕儉傪嵞婲摦屻偵揔梡偝傟傑偡乯,0
242,帇擣惈偺岦忋,乮O値偵偡傞偲攚宨偑埫偔側傝丄傾僀僥儉偺摟柧搙偑忋偑傝傑偡乯,0
243,僥僉僗僩傾僯儊乕僔儑儞偺愝掕,乮O値偵偡傞偲僥僉僗僩昞帵墘弌偑側偔側傝傑偡乯,0
244,偄偄偹傾僀僥儉偺尒偨栚傪曄峏,乮愒偄僴乕僩宆傕偟偔偼墿怓偄惎宆偵曄峏壜擻偱偡乯,0
245,僒僂儞僪API偺愝掕,乮僒僂儞僪偑惓忢偵嵞惗偝傟側偄応崌偵偍帋偟偔偩偝偄丒僎乕儉傪嵞婲摦屻偵揔梡偝傟傑偡乯,0
246,愝掕傪弶婜壔,NULL,0
247,愝掕傪曐懚偟偰栠傞,NULL,0
248,嬻偒,NULL,0
249,嬻偒,NULL,0
250,帪偺僋僀乕儞偵彑棙偟偨僶僯儔偁傝偡偼丄,帺傜僋僀乕儞傪柤忔傝巒傔偨,0
251,偳偆偱偡偐両,偁傝偡偙偦偑嵟嫮偺抏枊彈巕偱偡両,0
252,偙偙偼堦敪惗攝怣巒傔偪傖偄傑偡傛乕両,NULL,0
253,傆傆傆乣乧偁偭両,僗僷僠儍偁傝偑偲偆偛偞偄傑偡乕両垽偟偰傑偡偭両,0
254,偁傝偡偺偳傫側偲偙傠偑尒偨偄偱偡偐乣丠,NULL,0
255,偊乣偦傟偼峌傔偡偓偱偡傛乣丠傑偁僋僀乕儞側偺偱,戝忎晇偱偡傛偹乣乮崻嫆側偟乯乧偊偄傗偭,0
256,晄揔愗側攝怣傪専抦偟傑偟偨丅,傾僇僂儞僩傪搥寢偟傑偡丅,0
257,偦傫側乣両,偙傟偠傖傑偨侾偐傜僼僅儘儚乕廤傔捈偟偩乣両,0
258,斵彈偼彸擣梸媮偑嫮偄偺偱偍偩偰傜傟傞偲,偍偩偰傜傟傞傎偳挷巕偵忔偭偰偟傑偆偺偱偟偨,0
259,帪偺僋僀乕儞傪摙偪搢偟偨備傝怱垽偼偦偺妶桇傪擣傔傜傟丄,僋僀乕儞偲屇偽傟傞傛偆偵側偭偨,0
260,偆傆傆乧抏枊傕嫮偔偰偐傢偄偄巹偭偰,姰慡柍寚偹乧,0
261,乽嫮偄偺偼惁偄偗偳,僫儖僔僗僩偡偓偰婥帩偪埆偄乿,0
262,偁傜偁傜乧巹偺枺椡偑傢偐傜側偄側傫偰,婱彈偒偭偲帇椡偑棊偪偰傞傫偠傖側偄偱偡偙偲丠,0
263,乽傕偰偼傗偝傟偰揤嬬偵側偭偰傞捝偄巕乿,乽慜偺僋僀乕儞傛傝僔儑儃偔側偄丠乿,0
264,偄偄偱偡偐偀丠婱彈曽傒偨偄側仭仭仭仭偼,仭仭仭偟偰仭仭仭仭仭仭仭仭仭仭仭仭乧,0
265,晄揔愗側昞尰偑孞傝曉偝傟偰偄傑偡丅,傾僇僂儞僩傪搥寢偟傑偡丅,0
266,偙偺仭仭塣塩傔乧,NULL,0
267,斵彈偼尵傢傟傞偲攞偵偟偰尵偄曉偝偢偵偼,偄傜傟側偄偺偱偟偨,0
268,僔僗僥儉傪僴僢僋偟偰婾傝偺悢帤傪摼偰偄偨僋僀乕儞傪,搢偟偨倀俰俙俲俷乮杮柤丗塅帯壆傒傗偙乯,0
269,傆偼偼両変偑偁偄偮偵晧偗傞傢偗偑側偄偺偩両,NULL,0
270,傒傗偙両偍傑偊偉偉偉偉偉両両両両,NULL,0
271,偣偭偐偔僔僗僥儉偺僴僢僋偵惉岟偟偨偺偵両,側傫偱幾杺偡傞傫偩両,0
272,巓婱偺傗偭偰傞偙偲偼偮傑傜傫両,悢帤偩偗憹傗偟偰壗偑柺敀偄両,0
273,僶儗僢僩乕僋慡懱偑儚僞僔偵拲栚偟偰偨偩傠両,偡偛偔側偄偐両丠,0
274,傒傗偙偙偦偮傑傫偹乕夵憿偱梀傫偱傞偔偣偵乕両,NULL,0
275,偙偆偄偆梀傃偼僶儗偢偵僐僢僜儕傗傞傕傫偩偲,傢偐傜傫偺偐僶僇巓婱両,0
276,偙偆偟偰寲壾偟偰傞娫乧僔僗僥儉偑惓忢偵側偭偨塣塩偵,擇恖偲傕傾僇僂儞僩搥寢偝偣傜傟偰偄偨,0
277,嬻偒,NULL,0
278,嬻偒,NULL,0
279,嬻偒,NULL,0
280,僋儕傾偍傔偱偲偆偛偞偄傑偡両,偁側偨偙偦偑抏枊僋僀乕儞偱偡両,0
281,僫僀僩儊傾僋儕傾偍傔偱偲偆偛偞偄傑偡両,偙偺埆柌偺傛偆側抏枊傪傛偔偧撍攋偝傟傑偟偨両,0
282,僇僆僗僋儕傾偍傔偱偲偆偛偞偄傑偡両,偁乧偁側偨偼堦懱壗幰側偺偱偡偐両丠,0
283,僋儕傾偍傔偱偲偆偛偞偄傑偡両,偁偺斀懃媺抏枊偵彑棙偟偨偁側偨偼偡偛偄両,0
284,僫僀僩儊傾僋儕傾偍傔偱偲偆偛偞偄傑偡両,偁側偨偙偦僋僀乕儞傪挻偊偨恄偵憡墳偟偄両,0
285,偙偺僎乕儉偱嵟嫮偺儃僗傪偁側偨偼搢偟傑偟偨両,傕偆扤傕偁側偨傪巭傔傜傟傑偣傫両,0
286,僩儔僀傾儖僋儕傾偍傔偱偲偆偛偞偄傑偡両,偄偞抏枊僔儏乕僥傿儞僌摴傊両,0
287,僩儔僀傾儖僋儕傾偍傔偱偲偆偛偞偄傑偡両,偙傟偼傒傫側偵帺枬偱偒傑偡傛偭両,0
288,僩儔僀傾儖僋儕傾偍傔偱偲偆偛偞偄傑偡両,偁側偨偼傕偟偐偟偰恖娫偱偼側偄偺偱偼乧丠,0
289,恀偺僋儕傾偍傔偱偲偆偛偞偄傑偡両,挻惁榬僔儏乕僞乕両,0
290,恀偺僋儕傾偍傔偱偲偆偛偞偄傑偡両,偁側偨偼傕偟偐偟偰乧僔儏乕僥傿儞僌偺恄両丠,0
291,傑偝偐乧傑偝偐偺僋儕傾両,偁側偨偼恄傪傕挻偊傑偟偨両,0
292,偙偙傑偱摓払偡傞幰偑尰傟傞側傫偰乧両,儔僀僋僪儕乕儅乕傪偙傫側偵傕梀傫偱偄偨偩偗偰姶幱偱偡両,0
293,姰憱偍傔偱偲偆偛偞偄傑偡両,枮懌偺偄偔僞僀儉偼弌傑偟偨偐丠,0
294,嬻偒,NULL,0
295,偄偦偘乣両妋偐揋傪側傞傋偔憗偔搢偡偲,僗僋儘乕儖偑憗偔側傞傫偱偟偨傛偹丠,0
296,僗僺乕僪儔儞傛乧栚偵晅偄偨揋偼,庤嵺傛偔偍憒彍偟偰偁偘傑偟傚乧,0
297,愙嬤僔儑僢僩傗儃儉丄僼傿乕僶乕傪嬱巊偟偰,傛傝懍偄僞僀儉傪栚巜偡偺偠傖両,0
298,嬻偒,NULL,0
299,嬻偒,NULL,0
300,亂俫俬俶俿亃,僶僯儔偁傝偡偝傫両偙偙偑婃挘傝偳偒偱偡両,0
301,亂俫俬俶俿亃,備傝怱垽偝傫両偁側偨偺椡傪尒偣偰偔偩偝偄両,0
302,亂俫俬俶俿亃,倀俰俙俲俷偝傫両偁側偨側傜偒偭偲懪奐偱偒傑偡両,0
303,亂俫俬俶俿亃,儊僀儞儌乕僪傪恑傔偰傒傑偟傚偆丅,0
304,亂俫俬俶俿亃,儊僀儞儌乕僪傪恑傔偰傒傑偟傚偆丅,0
305,亂俫俬俶俿亃,儊僀儞儌乕僪傪恑傔偰傒傑偟傚偆丅,0
306,亂俫俬俶俿亃,儊僀儞儌乕僪傪恑傔偰傒傑偟傚偆丅,0
307,亂俫俬俶俿亃,儊僀儞儌乕僪傪恑傔偰傒傑偟傚偆丅,0
308,亂俫俬俶俿亃,儊僀儞儌乕僪傪恑傔偰傒傑偟傚偆丅,0
309,亂俫俬俶俿亃,儊僀儞儌乕僪傪恑傔偰傒傑偟傚偆丅,0
310,亂俫俬俶俿亃,儊僀儞儌乕僪傪恑傔偰傒傑偟傚偆丅,0
311,亂俫俬俶俿亃,儊僀儞儌乕僪傪恑傔偰傒傑偟傚偆丅,0
312,亂俫俬俶俿亃,偁偺僋僀乕儞傪搢偟傑偟傚偆両,0
313,亂俫俬俶俿亃,僩儔僀傾儖偵嫲傠偟偄揋偑塀傟偰偄傞偦偆偱偡乧丅,0
314,亂俫俬俶俿亃,僩儔僀傾儖偵塀偝傟偨僐儈儏僯僥傿傪僋儕傾偟偰傒傑偟傚偆丅,0
315,亂俫俬俶俿亃,僩儔僀傾儖傪僋儕傾偟偰傒傑偟傚偆両,0
316,亂俫俬俶俿亃,偡傋偰偺儃僗傪搢偟偪傖偄傑偟傚偆両,0
317,亂俫俬俶俿亃,偡傋偰偺僗僥乕僕傪堦婥偵撍攋偟偪傖偄傑偟傚偆両,0
318,亂俫俬俶俿亃,僗僺乕僪儔儞偵挧愴偟傑偟傚偆両,0
319,亂俫俬俶俿亃,僩儔僀傾儖僣傾乕偱埆柌偺傛偆側抏枊傪撍攋偟偰傒傑偟傚偆両,0
320,嬻偒,NULL,0
321,嬻偒,NULL,0
322,嬻偒,NULL,0
323,嬻偒,NULL,0
324,嬻偒,NULL,0
325,亂僶僯儔偁傝偡亃,僶僯儔偁傝偡偱僄儞僨傿儞僌傪尒偨,0
326,亂備傝怱垽亃,備傝怱垽偱僄儞僨傿儞僌傪尒偨,0
327,亂倀俰俙俲俷亃,倀俰俙俲俷偱僄儞僨傿儞僌傪尒偨,0
328,亂傕偪傕偪偹偹偪傖傫亃,僗僥乕僕侾傪僋儕傾偟偨,0
329,亂傑偳偐亃,僗僥乕僕俀傪僋儕傾偟偨,0
330,亂嶗嶁浠乆壴亃,僗僥乕僕俁傪僋儕傾偟偨,0
331,亂僋儔僎偺傒偯偒亃,僗僥乕僕係傪僋儕傾偟偨,0
332,亂奊巕亃,僗僥乕僕俆傪僋儕傾偟偨,0
333,亂偒傘傝亃,僗僥乕僕俇傪僋儕傾偟偨,0
334,亂備傔傒傞儉僂亃,僗僥乕僕俇傪僋儕傾偟偨,0
335,亂嬻惎僋儕儉亃,僗僥乕僕俈傪僋儕傾偟偨,0
336,亂嬻惎僔傾儞亃,僗僥乕僕俈傪僋儕傾偟偨,0
337,亂僋僀乕儞儊儘僫亃,僗僥乕僕俉傪僋儕傾偟偨,0
338,亂愨懳彑幰両儊儘僫亃,僗僥乕僕俋傪僋儕傾偟偨,0
339,亂揤枮嫶僸僫僐亃,僗僥乕僕僄僋僗僩儔傪僋儕傾偟偨,0
